{
  "schema": 1,
  "view": "round_results",
  "filter_digest": "6c1ee269fe62a8246c9e6a64caee5d9408eb491fbdf06f20745521757115c8ea",
  "after": {
    "kind": "result",
    "input_seq": 1,
    "attempt_ordinal": 2,
    "input_id": "00000000-0000-4000-8000-000000000070",
    "attempt_id": "00000000-0000-4000-8000-000000000061"
  },
  "revision": 21
}
